{
  "$schema": "https://json-schema.org/draft/2020-12/schema",
  "title": "Skill Registry Record",
  "type": "object",
  "additionalProperties": false,
  "required": [
    "id",
    "name",
    "description",
    "category",
    "tags",
    "inputs",
    "outputs",
    "dependencies",
    "file_location",
    "version",
    "updated",
    "official_sources",
    "references",
    "templates",
    "scripts",
    "chunk_ids",
    "vector_embedding",
    "content_hash"
  ],
  "properties": {
    "id": {"type": "string"},
    "name": {"type": "string"},
    "description": {"type": "string"},
    "category": {"type": "string"},
    "tags": {"type": "array", "items": {"type": "string"}},
    "inputs": {"type": "array", "items": {"type": "string"}},
    "outputs": {"type": "array", "items": {"type": "string"}},
    "dependencies": {"type": "array", "items": {"type": "string"}},
    "file_location": {"type": "string"},
    "version": {"type": "string"},
    "updated": {"type": "string"},
    "official_sources": {"type": "array", "items": {"type": "string"}},
    "references": {"type": "array", "items": {"type": "string"}},
    "templates": {"type": "array", "items": {"type": "string"}},
    "scripts": {"type": "array", "items": {"type": "string"}},
    "chunk_ids": {"type": "array", "items": {"type": "string"}},
    "vector_embedding": {
      "type": ["object", "null"],
      "additionalProperties": false,
      "required": ["backend", "vector_id", "dimension", "updated"],
      "properties": {
        "backend": {"type": "string"},
        "vector_id": {"type": "string"},
        "dimension": {"type": "integer", "minimum": 1},
        "updated": {"type": "string"}
      }
    },
    "content_hash": {"type": "string"}
  }
}
