{
  "category": "admin",
  "chunk_ids": [
    "011bc91b03031f41926c",
    "02af00f6f17880b6f704",
    "039cde52b4ab9517fc75",
    "03b32b40de093179812e",
    "04e8dc37720ce9924c43",
    "051d864308337b65c929",
    "0873d2f5ae38bdb32793",
    "0b50c589a987a339477e",
    "13bf59a682295a9434f1",
    "14b5b80e5645a3db23e8",
    "18eb945c6441179aba18",
    "1a935249aea7a464e190",
    "1cf138ea5a52352f0309",
    "1f01ef5fc07b44452271",
    "27adf3455efa9d6e81f6",
    "28b213e14859dadf83b5",
    "386bbbfbaa5f9c3bf9bc",
    "396faff3971ce2f5616d",
    "3ab93dc74a0dbd083658",
    "3c2cc1bee6d81ba704b3",
    "3f4232d8380ae1f07c01",
    "3f5333d70c42c04c4e1a",
    "3fbff4114e003d682014",
    "468e5a6010707cfdfa25",
    "474fa55ba216aa8bca19",
    "48d66a97155fe9b0cdc5",
    "4aed294a7b6ef2569f3b",
    "4f87f9b21f961e1bf1a4",
    "534427028d42ddf130c4",
    "541dcdcf1987313848f0",
    "584b4c80427369ee0960",
    "61d0bdcd8919c7d9bcb2",
    "661ccf127ea31c98323e",
    "66420b51fe85ece442ce",
    "672b06275ba77c6e91be",
    "6a206892103b53a82162",
    "71609eda4ee4ca321de7",
    "71e149f71249740cac84",
    "73e2c92a9cb01a5efdff",
    "73ed37d82faa83688638",
    "7642cc889759eef32989",
    "7966e2d9cf7a63895cee",
    "7ad80f9d14d9e08ab972",
    "81978cd9fbb0feab4318",
    "85c95ef24de92b9e30ab",
    "86ce2269ba5a2d7487ab",
    "88c4683d14f8a382a828",
    "8a7accbb7c40f8af742b",
    "8aee7a37b35551e7bc11",
    "8b359d32d164c799b206",
    "8bc87b657c8a47c674fe",
    "8c040554e99065a62c1c",
    "8d3e6c5be11abef5af86",
    "930d2b125629e25af4c7",
    "952309c75d78b3564610",
    "982329a6c50f5e1e6f14",
    "a3e2c3d0f1909b2d3454",
    "a3f9dbc3578a681d353a",
    "a46c7f9c8eb946f55d1c",
    "a5c0ea084efc4d71c1bd",
    "b01e012d08670ef71d42",
    "b24227f55eac301f0b74",
    "b3f4771d3c66b496a0be",
    "b56b3d633cb10f189e32",
    "b890fa95acaa90f02210",
    "bb0f5aad8d36e17fc11a",
    "bb1ad004aa40478e3f17",
    "bc1edcc13a90674a19a4",
    "bce6fc6ea51b79624013",
    "bd162551e8804923216e",
    "c22e595ca2eecfccde73",
    "c266ca71d9b9588643bd",
    "c44055b49284dc191476",
    "cbcd3a8a4b4bfc243f09",
    "cc215506297960ca0701",
    "cfeabb4df905c4a4ad71",
    "d76e92ff08b7b4eae4e4",
    "db69041a6e0d9677c253",
    "dbd49023ea7bbab36060",
    "dbe52e0c0243a842c6c5",
    "dc7982436e1af98b93e9",
    "dcdaba76f6707c93583b",
    "e063a355de314c1ad45e",
    "e5030feacb302a07f322",
    "ead816a029b9f7737de3",
    "edd1f9d9d3aacccd01c0",
    "efc1940eb7296994314c",
    "f0d93bf2330557a2d30f",
    "f32beb4081a712c452ed",
    "f725e5cf53cc5b570762",
    "f9794ec39a0f8b689eb3",
    "fcf1c19b7070b524bdbd",
    "ffdf534c283b26909bfc"
  ],
  "content_hash": "aaf5e507df65a203bdd4d0cb29b40ac86e2245f8e93eee7c97bfc1acf5d71742",
  "dependencies": [],
  "description": "Use this skill to define and validate the requirements for a Salesforce Partner Relationship Management (PRM) implementation: deal registration flows, lead distribution models, partner tier hierarchies, MDF budget tracking, and co-marketing content entitlement. Trigger keywords: partner community requirements, PRM deal registration setup, channel partner portal requirements, lead distribution partner, partner tier management, MDF tracking, co-marketing entitlement. NOT for partner portal technical configuration (Experience Cloud site builder, Visualforce pages, LWC development). NOT for partner account management (account hierarchy or channel account teams).",
  "file_location": "skills/admin/partner-community-requirements",
  "id": "admin/partner-community-requirements",
  "inputs": [
    "Number and types of partner tiers (e.g., Gold / Silver / Bronze)",
    "Deal registration business rules \u2014 who can register, approval chain, duplicate prevention",
    "Lead distribution criteria \u2014 geography, product line, partner tier, capacity",
    "MDF budget allocation model \u2014 whether tracked in Salesforce or external system",
    "Co-marketing asset entitlement rules per tier",
    "Existing Experience Cloud org edition and license inventory"
  ],
  "name": "partner-community-requirements",
  "official_sources": [
    "Salesforce Well-Architected Overview \u2014 architecture quality framing (Trusted/Easy/Adaptable model, anti-pattern guidance)",
    "Partner Relationship Management (PRM) \u2014 Configure Deal Registration in Partner Central",
    "Configure Lead Distribution \u2014 Salesforce Help",
    "Partner Community License Overview \u2014 Salesforce Help",
    "Experience Cloud: Set Up a Partner Community \u2014 Salesforce Help"
  ],
  "outputs": [
    "PRM requirements document covering license model, tier hierarchy, deal registration flow, lead distribution rules",
    "Partner tier decision matrix with feature access and MDF eligibility per tier",
    "Deal registration approval workflow specification",
    "Lead distribution assignment rule specification",
    "Review checklist confirming configuration readiness before build"
  ],
  "references": [
    "skills/admin/partner-community-requirements/references/examples.md",
    "skills/admin/partner-community-requirements/references/gotchas.md",
    "skills/admin/partner-community-requirements/references/llm-anti-patterns.md",
    "skills/admin/partner-community-requirements/references/well-architected.md"
  ],
  "scripts": [
    "skills/admin/partner-community-requirements/scripts/check_partner_community_requirements.py"
  ],
  "tags": [
    "partner-community",
    "prm",
    "deal-registration",
    "lead-distribution",
    "partner-tiers",
    "mdf",
    "co-marketing",
    "experience-cloud"
  ],
  "templates": [
    "skills/admin/partner-community-requirements/templates/partner-community-requirements-template.md"
  ],
  "updated": "2026-04-06",
  "vector_embedding": null,
  "version": "1.0.0"
}
