{
  "category": "admin",
  "chunk_ids": [
    "0068f005db16a440d794",
    "0673222ec964a4a64471",
    "086cbd5896f39b683334",
    "0d643bed623daea9a9ee",
    "1c43e6983857ed5c0bd2",
    "2331673acc9a6b871b3f",
    "2590338806c0cb7f0d48",
    "2bfdbd4a1c823af0d552",
    "308f6813358fbb93fac0",
    "32b9bd7d8734276ea379",
    "34415e72a48eeb9819aa",
    "3bb75da3d7c078ef4e9c",
    "40b7b85077bd34bbfdab",
    "42ddd88402cc383383ff",
    "4c37e7e2fc284a90151c",
    "4dcd3a61d8e837022824",
    "4ea7d00567bd25474195",
    "53a85a6060a4f4121489",
    "5c45426ea002880ca656",
    "5ebc2560e72311f39caf",
    "5fd77af1b06420af76cf",
    "60e9281eea10334d0f90",
    "64daf2a1450de0fe8268",
    "67cb466221ee1e2a98ec",
    "69a6f7f7116e53267415",
    "6a3d3d78c6746c5a955b",
    "6ebd3a217250c61105d5",
    "6f2112e6a1f3e160ef75",
    "79bec4f1b567aaf679d6",
    "8af2ef120eb6087378e2",
    "8e50e8b402e4b1ecac56",
    "8e5827308331d15a7704",
    "9988494f35be43ea9cc5",
    "9aed34f4dd49f1c5b6f4",
    "9c54f3ee4783c6ea8009",
    "9de73d4aab13f381b767",
    "a0dfb8f9c4ecf2c5928d",
    "a4497e25bab2c116cf2d",
    "a56d03d94f241ebdcf2c",
    "a89ae2ef5e60a6f89d63",
    "acc465da844bd245209e",
    "b125df161550fcba2593",
    "b333be6d8cc7eba24620",
    "b8846eee3b017bb75f67",
    "b8880b4936015c1e9e8a",
    "c1e7faf06f30a61afff0",
    "c21322516dbe20c19420",
    "ccb92be9700f4f2b26d6",
    "ccfe2412c7099fa9c9b0",
    "d27439e90d98c2c37579",
    "d5394c969f17d9618ee7",
    "d5ecdcbfc78aee5f742c",
    "d79de6e0f40bd9620beb",
    "dc1b9a1204545149bbd1",
    "e958fbd733e2312ec94b",
    "ea30ecd8e8dad1118c1c",
    "eaea3d64d6bb50f1115b",
    "eb8d4e65eadf08c18891",
    "ef005d66712c28ab4673",
    "efe6562b4d4e9197c275"
  ],
  "content_hash": "481d42a5f992f220a70ac60ace9610dfc3e9523213ea3200122226e2b5c51311",
  "dependencies": [],
  "description": "Use when designing or refactoring record types across objects with many profiles, business processes, or picklist variations. Covers layout assignment explosion, Dynamic Forms migration, and record type ID portability. NOT for basic record type setup or page layout assignment \u2014 see record-types-and-page-layouts for introductory guidance.",
  "file_location": "skills/admin/record-type-strategy-at-scale",
  "id": "admin/record-type-strategy-at-scale",
  "inputs": [
    "List of objects with record types and current record type count per object",
    "Number of profiles and permission sets in the org",
    "Whether Dynamic Forms is enabled and which objects are compatible"
  ],
  "name": "record-type-strategy-at-scale",
  "official_sources": [
    "Object Reference \u2014 https://developer.salesforce.com/docs/atlas.en-us.object_reference.meta/object_reference/sforce_api_objects_concepts.htm",
    "Metadata API Developer Guide \u2014 https://developer.salesforce.com/docs/atlas.en-us.api_meta.meta/api_meta/meta_intro.htm",
    "Metadata API \u2014 RecordType \u2014 https://developer.salesforce.com/docs/atlas.en-us.api_meta.meta/api_meta/meta_recordtype.htm",
    "Salesforce Well-Architected Overview \u2014 https://architect.salesforce.com/docs/architect/well-architected/guide/overview.html",
    "Salesforce Architect Decision Guide \u2014 Build Forms \u2014 https://architect.salesforce.com/decision-guides/build-forms",
    "Assign Record Types and Page Layouts \u2014 https://help.salesforce.com/s/articleView?id=sf.customize_recordtype.htm"
  ],
  "outputs": [
    "Record type rationalization plan with consolidation recommendations",
    "Layout assignment matrix showing before and after state",
    "Migration checklist for record type consolidation or Dynamic Forms adoption"
  ],
  "references": [
    "skills/admin/record-type-strategy-at-scale/references/examples.md",
    "skills/admin/record-type-strategy-at-scale/references/gotchas.md",
    "skills/admin/record-type-strategy-at-scale/references/llm-anti-patterns.md",
    "skills/admin/record-type-strategy-at-scale/references/well-architected.md"
  ],
  "scripts": [
    "skills/admin/record-type-strategy-at-scale/scripts/check_record_type_strategy_at_scale.py"
  ],
  "tags": [
    "record-type-strategy-at-scale",
    "record-types",
    "page-layouts",
    "dynamic-forms",
    "layout-assignment",
    "picklist-values"
  ],
  "templates": [
    "skills/admin/record-type-strategy-at-scale/templates/record-type-strategy-at-scale-template.md"
  ],
  "updated": "2026-04-05",
  "vector_embedding": null,
  "version": "1.0.0"
}
