{
  "category": "admin",
  "chunk_ids": [
    "00a33fdf80d01016613d",
    "05a505ffb7ecd476ec2c",
    "06c4505078821e9ad1ce",
    "088ecbdcc6818c0bd3c6",
    "0ab04573f4d369db83db",
    "175fbd8f891b8f118374",
    "196ad15a1ef7f29d6599",
    "19fb400817fd4a0032aa",
    "1ef3a6351543ffe7dbe5",
    "1f2a7ad97d45deb36cd6",
    "1fbf956316ad081d4369",
    "26ebedd83a7461b4c5fe",
    "27a8ba4f957e198a8dbc",
    "2b179b8a9749e671e77c",
    "2cce078f6dfd58159fc8",
    "2e20e2c0c39be32fc357",
    "2e96c9356a52ad372e63",
    "315d392c490178948c30",
    "3316c6e115b7a67583ff",
    "380892a0218e4f189f75",
    "39b919b8a1f7df18821a",
    "3edfe6ffe17148b48e25",
    "418f3a6f770d9e7b8890",
    "4356b7d1c74b8112c2d9",
    "46230efcbfcfed721cbe",
    "4a1b2a1fe427c42510b0",
    "4d3e52e5e776aa905a57",
    "4d59b50248b63cddb00a",
    "51ef82add7d937c2cd71",
    "5460bec80d5e3afca5e0",
    "6077edc82984c3bf4e1a",
    "624ae6e8e547d5445af8",
    "656313d36c108adcffab",
    "67db94dc07cf9ae61ae0",
    "6a24ac51b93c44d0e892",
    "6f2d09296cccb630cc45",
    "6fe0772bc5069bb4adf1",
    "78fe402ce2673ae324c1",
    "7b463b5d35ff63b215eb",
    "7dee0a22606d755729be",
    "7e0e3b4776322449a7bd",
    "7fc17b4e953debf09a83",
    "816f59730a554851012a",
    "827e187967e0baa6fdfe",
    "828a19a5222b757329cc",
    "8652054f67e5a43aec46",
    "88ffac3493f3dbea0ec1",
    "8cb6b334187e3d6827ca",
    "92efd15907cfc46e63d5",
    "9b65959fe1d54bb21ff9",
    "a0d63613885f6bc6fcea",
    "a12d07fe0e9ce064a640",
    "a2be53b8c3315a2169fb",
    "a46f859f893b93325d0a",
    "a75b6573b4fd1d5be47f",
    "ab554fdf471da9275579",
    "ab7b4cc5a4e868830cf2",
    "abe334679d603c619c84",
    "b3196015ca3410d00b68",
    "b3fd4acea5d9fc776734",
    "b42cd5971df27010f7f2",
    "ba6bc0ae8d9117be329d",
    "bbfbb7ec2dd6ea1ccfe4",
    "bc623957a223ab2666f0",
    "c03a87338469a04b9b30",
    "c20dc7d1c33f69c9aa43",
    "c6a7a65d9c65e690222f",
    "c9086f2ce084d146f72e",
    "c9b03b24013bc090e5b3",
    "cd6061d8156e07e79d9b",
    "d45975eee2b0ac92d3d7",
    "d86110564e6945aa522e",
    "dd2c0efa3ca252d4350d",
    "de468c37bf8ae19c73e5",
    "df5e3585d4a626f5e482",
    "e7467a722cabb9a07ac0",
    "eaa2645ca25fb10f0a27",
    "eef01bd54fa06c86afb1",
    "f33493f34c9b5031a984",
    "f4e99c4480ae673e6195",
    "f7d7441c78c52d2c468d",
    "fcb3e8106e980437e9cb",
    "fdf001675bc95dd27400"
  ],
  "content_hash": "bc2e52f9c6db62f1276d487248058f302a742d4cd82e38ec4d8eb7f4c6b3a43c",
  "dependencies": [],
  "description": "Use when creating, assigning, or checking custom permissions to control feature access beyond CRUD and FLS. Trigger keywords: 'custom permission', 'FeatureManagement.checkPermission', '$Permission global variable', 'feature gate', 'named access grant', 'beta feature flag'. NOT for permission sets (use permission-set-architecture).",
  "file_location": "skills/admin/custom-permissions",
  "id": "admin/custom-permissions",
  "inputs": [
    "API name of the custom permission to create or check",
    "permission sets that should grant the permission",
    "platform contexts that need to read the permission (Apex, Flow, formula, validation rule)"
  ],
  "name": "custom-permissions",
  "official_sources": [
    "Salesforce Help \u2014 Custom Permissions Overview: https://help.salesforce.com/s/articleView?id=sf.custom_perms_overview.htm",
    "Salesforce Help \u2014 Use Custom Permissions in Formulas: https://help.salesforce.com/s/articleView?id=sf.custom_perms_build_in_formula.htm",
    "Apex Developer Reference \u2014 FeatureManagement Class: https://developer.salesforce.com/docs/atlas.en-us.apexref.meta/apexref/apex_class_System_FeatureManagement.htm",
    "Salesforce Well-Architected Overview: https://architect.salesforce.com/docs/architect/well-architected/guide/overview.html",
    "Metadata API Developer Guide \u2014 CustomPermission: https://developer.salesforce.com/docs/atlas.en-us.api_meta.meta/api_meta/meta_customperm.htm"
  ],
  "outputs": [
    "configured custom permission record with correct API name and label",
    "permission set XML including the custom permission node",
    "Apex, formula, validation rule, or Flow expressions that read the permission",
    "checker report of which permission sets grant which custom permissions"
  ],
  "references": [
    "skills/admin/custom-permissions/references/examples.md",
    "skills/admin/custom-permissions/references/gotchas.md",
    "skills/admin/custom-permissions/references/llm-anti-patterns.md",
    "skills/admin/custom-permissions/references/well-architected.md"
  ],
  "scripts": [
    "skills/admin/custom-permissions/scripts/check_custom_permissions.py"
  ],
  "tags": [
    "custom-permissions",
    "access-control",
    "permission-set",
    "feature-flags",
    "apex"
  ],
  "templates": [
    "skills/admin/custom-permissions/templates/custom-permissions-template.md"
  ],
  "updated": "2026-04-04",
  "vector_embedding": null,
  "version": "1.0.0"
}
