{
  "category": "apex",
  "chunk_ids": [
    "05f6c332c4e4be7a19fb",
    "09b902644f9be11527c2",
    "0ad01e2247bdc8c8f372",
    "101947ae6d045170a5f5",
    "1371c8441346bc22ef7e",
    "157500863efe5c23efd1",
    "1b01ca75cb8cccd36c29",
    "2acf6b1ccbeb52345918",
    "2c74b7a8054b26f4f09a",
    "2cb4dab47a6fcb3e8b6d",
    "37951ee951e3bfb4d2c6",
    "37dbbbf18696fb960c85",
    "3817ab77796968e04bda",
    "39fe9965212bd5325af9",
    "3aec12df85c8afb2e730",
    "3ed02af2b9ac9d8e18db",
    "3fc0a87399e930d15e39",
    "401415f315a35216dc13",
    "42a4cedf12098ccc5568",
    "4542d73baf1a3688d4e7",
    "47b6d83cc8158d6b1af5",
    "4bb247c45e45a788b200",
    "4d26fb501d28ca5e5331",
    "50186f420f685df6f963",
    "5353d9a86230633daaea",
    "585ef933b65e803f8e39",
    "5aae5a79ea268c81c99b",
    "688424df4ce38f9c2c44",
    "6e177bc5a0a54dafb48e",
    "7476f02a7a965b0c6c04",
    "75328a4cad73c5dd3eec",
    "79846984b3025beeec20",
    "7b646496b0865a80b5f4",
    "7bc6158ed67cbe48e729",
    "7e40280a1be587ba6aff",
    "80e88ad6bdf44989e029",
    "863312440e3b449d6110",
    "86f001c71217a17c91cc",
    "8803a7355de131b80e2e",
    "8ba6cd5f7f7e3c7e6961",
    "8cc0d32f2f3e803c4229",
    "8e88de50c6ab2d078a08",
    "8fd6e4a6184f09242054",
    "9043771b7f07e468e71f",
    "92555114c9e9e645c5d9",
    "956510ab8919403c726a",
    "a05582874bfb4d7f851f",
    "a0e0bf0e562fe58b5958",
    "a18c8aa10d613a69eb05",
    "a1ba99f03c589b0f7771",
    "a33e954e59dea5283238",
    "a57f51b5f4e4779d3d8a",
    "a6cbfa660405970065e1",
    "aaca46d40a8522d626bd",
    "ac70c628044c767543f2",
    "aee18269732aaa93511a",
    "af7a411a6c2aff6d3072",
    "b3c9f2657a34ab580264",
    "b535b522183412501701",
    "b6a090dcb7606225d37b",
    "b965d96e3366fc11dee3",
    "bd1339044016eb9cb56f",
    "c1a72d5b7ca7a64b27e6",
    "c428c60c2ca948577518",
    "c89bcd88f02fcc882b90",
    "cb60c0887d2e843f4145",
    "cbc160b3f80d1dc73a10",
    "cc4bfebe13613089ee19",
    "cec237379942b44f106a",
    "d02496c5de30a05fc45e",
    "d15d9d5f0347828cff2c",
    "d1b93a31137eafa4910a",
    "d9ec844060b841713906",
    "dabd4f87762f8bd5af53",
    "e900db4137021ef8faee",
    "ee3e5c8d0d8235b1010f",
    "ef10807ca0345e140707",
    "f2636aca95b1305e211a",
    "f29687840bbdc0d0f461",
    "f3fba1a7b3af05d15fa1",
    "f5e76b855fbce69ad276",
    "f7b5c9f8f88b7ec91834",
    "fa3575ac26fcbb428b8f",
    "fb7215433713cd4567c9"
  ],
  "content_hash": "cc8a00e5c867b6d481fabb26b1f6061d40f20409e0f4dfee090e4151cacc817b",
  "dependencies": [],
  "description": "Use when building or debugging a browser-based CTI softphone adapter using the Salesforce Open CTI JavaScript API \u2014 covers callcenter.xml definition, Lightning utility item registration, core API methods (enableClickToDial, onClickToDial, screenPop, setSoftphonePanelHeight, saveLog), call logging as Task, and the lightning-click-to-dial LWC component. NOT for Service Cloud Voice Amazon Connect setup, Omni-Channel routing configuration, or CTI adapter AppExchange package selection.",
  "file_location": "skills/apex/cti-adapter-development",
  "id": "apex/cti-adapter-development",
  "inputs": [
    "Telephony vendor requirements (SIP endpoint, WebRTC or PSTN bridge details)",
    "Lightning App where the softphone utility item should appear",
    "Salesforce objects to screen-pop on incoming calls (Contact, Case, Lead)",
    "Existing callcenter.xml or adapter page URL if already partially built"
  ],
  "name": "cti-adapter-development",
  "official_sources": [
    "Open CTI Developer Guide \u2014 https://developer.salesforce.com/docs/atlas.en-us.api_cti.meta/api_cti/sforce_api_cti_intro.htm",
    "Open CTI Methods for Lightning Experience \u2014 https://developer.salesforce.com/docs/atlas.en-us.api_cti.meta/api_cti/sforce_api_cti_methods_lightning.htm",
    "Call Center Definition File \u2014 https://developer.salesforce.com/docs/atlas.en-us.api_cti.meta/api_cti/sforce_api_cti_callcenter_def.htm",
    "lightning-click-to-dial Component Reference \u2014 https://developer.salesforce.com/docs/component-library/bundle/lightning-click-to-dial/documentation",
    "Salesforce Well-Architected Overview \u2014 https://architect.salesforce.com/docs/architect/well-architected/guide/overview.html",
    "Salesforce Well-Architected: Trusted \u2014 https://architect.salesforce.com/docs/architect/well-architected/trusted/overview.html"
  ],
  "outputs": [
    "Compliant callcenter.xml Call Center definition file",
    "JavaScript Open CTI adapter hosted page with API method implementations",
    "Lightning utility bar softphone configuration steps",
    "Call logging Task creation pattern using saveLog",
    "lightning-click-to-dial LWC integration snippet"
  ],
  "references": [
    "skills/apex/cti-adapter-development/references/examples.md",
    "skills/apex/cti-adapter-development/references/gotchas.md",
    "skills/apex/cti-adapter-development/references/llm-anti-patterns.md",
    "skills/apex/cti-adapter-development/references/well-architected.md"
  ],
  "scripts": [
    "skills/apex/cti-adapter-development/scripts/check_cti_adapter_development.py"
  ],
  "tags": [
    "open-cti",
    "cti-adapter",
    "softphone",
    "click-to-dial",
    "call-logging",
    "lightning-utility-bar",
    "callcenter-xml"
  ],
  "templates": [
    "skills/apex/cti-adapter-development/templates/cti-adapter-development-template.md"
  ],
  "updated": "2026-04-06",
  "vector_embedding": null,
  "version": "1.0.0"
}
