{
  "category": "devops",
  "chunk_ids": [
    "058a6dac4440298a3d6f",
    "079ba6efd096d9a7c5ad",
    "086e7c8dae040331b90e",
    "0b72ebfb876c886cb7ca",
    "0e1b215c838922d2add8",
    "1594b4ad7c7ff3e79203",
    "16b00486b3e8dc7ad927",
    "17c197a60e56ae7b4f86",
    "1e4c30c5be5974722e4c",
    "212408875f89b4d657a3",
    "2209f95fabe41f0ac2a6",
    "23bc36c2c50dfe429353",
    "24dd1324b6918de75785",
    "2646fe51c4d35d5f83e2",
    "2990bddb10b90d9f3e5e",
    "303375a5bd53a0fba45a",
    "3353bfbfb5392dd1a3e9",
    "35f70f53489fdd8f15e0",
    "36e107840844df2df30f",
    "386f5a369611dad668c3",
    "3a2b506ac32c3b5d18d7",
    "3b04d9138f2fb51f5047",
    "3c4bf7b1788938ac3b31",
    "41b76a832d6b9c6e1954",
    "41ce4bb0bb678d552dd5",
    "440c91e275b4325f2e14",
    "4789df2830e86faef0c9",
    "49d10e51ab347b3e3796",
    "4c1005ef584f6bd2f2cf",
    "4cee21a7a9da89efb4ad",
    "4d7ad3526e28aa0043ec",
    "4e8c20dc4f799b47d092",
    "50633c7237bee310a1e3",
    "554db388a41a16431abd",
    "55bc93d65062a61201b2",
    "55f9fd297ace1efc392d",
    "567f9494ce090de40414",
    "5d315fc7274510532811",
    "6021772a2955492e782d",
    "6038edd61a8b8f3b358f",
    "65e72976c764a4982335",
    "66adcbf78c958223618b",
    "68fbb8594bb8e5f1a09a",
    "6a1e88c8b8da74720577",
    "6a34dbbf3601508d02da",
    "6df0304586da4695008a",
    "6e63f15dced984ce664c",
    "729231b2a48a8b5742f6",
    "7425d2fb17d4e1031623",
    "74bac2167f12b3b8fd31",
    "753dc7ae8d398f2a4431",
    "762a566ee242b5f85901",
    "7d0481c28f0b3c529b3a",
    "803a404ba5a4cc385ed4",
    "81b910ad4b94e40efc74",
    "81bfe4a2a3841b7d71f4",
    "858d177c93704e89647d",
    "8a16373d010bd3fdcaaf",
    "8d1c92083962e9ea0cf2",
    "8e2d93bac9b46f1f724b",
    "8e935ce8b529ff3723db",
    "8ec65119acb68c4b1cec",
    "8f3dd436f81d3e8b526a",
    "9172fdabfd14fddae034",
    "92ee2e2d7dae18881a7e",
    "9503526f34b11b60d9ad",
    "963e4faf6a405fbf0f41",
    "a09dee3ab808d64cc694",
    "a165b9a92f187de25258",
    "a1fe848c8a36f6667d93",
    "a535a6aa59c7a34f45d8",
    "a90a253057ef8c7d44ba",
    "aa3e9536d801eb6866fc",
    "abe871559665559d490d",
    "acab075a5d48c030cede",
    "ad431247fa0892980945",
    "aecdf2fd18f4974780ae",
    "b048304e7e297c5eb5fa",
    "b1312e004afaeda25880",
    "b4c6d4033b0a5f9a0332",
    "b5114464f1b618dbe9f5",
    "b5310be9fb200e18d54d",
    "b5f9b1d5217270ae24b9",
    "b66e001beccba150ec93",
    "bc70a3e373b8ffbbff55",
    "c210d8b128af2667350b",
    "c33760c424f5423d9533",
    "c4240d7ba47231686afa",
    "c51fa422c0b22fd337da",
    "cb146b2fa20a71fa2f75",
    "cc5f15e5192fb234ec11",
    "d0676dd05fc7bbb9ab16",
    "d0d23f62d4bd4c469651",
    "d2b428e4c2c09f04102a",
    "d456f3982b3b6c246818",
    "d911b7398bda77ba6138",
    "d9e065cdf0b59a6e6d38",
    "e08e6fe4672bd4081e24",
    "e0d7ffb06e2e788666b5",
    "e571d11cd4884b6bd6ba",
    "e763cd6019abe97bb104",
    "e7702a1245da4e87b144",
    "eef2cb3b8713fd3f7b86",
    "f1f3dd1558e196500fd3",
    "f72c8163d57e08df2008",
    "f94f13768813348f7f10"
  ],
  "content_hash": "fac1dcb3de804c9ee10e22bc370601c333ceccc318cbf5fad555e192462b6aec",
  "dependencies": [],
  "description": "2GP managed package development: creating managed packages with Dev Hub and Salesforce CLI, semantic versioning, patch versions, namespace linking, ISV AppExchange listing, and subscriber upgrade management. NOT for unlocked packages, unmanaged packages, or 1GP-only workflows.",
  "file_location": "skills/devops/second-generation-managed-packages",
  "id": "devops/second-generation-managed-packages",
  "inputs": [
    "Dev Hub org (Partner Business Org preferred) with Second-Generation Managed Packaging enabled",
    "Namespace registered in a Developer Edition org and linked to the Dev Hub",
    "Salesforce CLI installed and authenticated to the Dev Hub",
    "sfdx-project.json with packageDirectories, namespace, and packageAliases configured",
    "Apex test coverage at or above the required threshold (75% for production-ready versions)"
  ],
  "name": "second-generation-managed-packages",
  "official_sources": [
    "Second-Generation Managed Packages Developer Guide (First-Generation Managed Packages companion) \u2014 local import at `knowledge/imports/pkg1-dev.md`; covers Dev Hub enabling, namespace linking, 1GP\u21922GP migration, patch versioning, and conversion workflow",
    "Salesforce DX Developer Guide \u2014 https://developer.salesforce.com/docs/atlas.en-us.sfdx_dev.meta/sfdx_dev/sfdx_dev_intro.htm \u2014 project structure, scratch org patterns, sfdx-project.json configuration",
    "Salesforce CLI Reference \u2014 https://developer.salesforce.com/docs/atlas.en-us.sfdx_cli_reference.meta/sfdx_cli_reference/cli_reference.htm \u2014 `sf package create`, `sf package version create`, `sf package version promote`, `sf package install`, `sf package push-upgrade schedule`",
    "Metadata API Developer Guide \u2014 https://developer.salesforce.com/docs/atlas.en-us.api_meta.meta/api_meta/meta_intro.htm \u2014 metadata type support in managed packages",
    "Salesforce Well-Architected Overview \u2014 https://architect.salesforce.com/docs/architect/well-architected/guide/overview.html \u2014 operational excellence, adaptability, and security pillar framing"
  ],
  "outputs": [
    "2GP managed package and package version registered in the Dev Hub",
    "Promoted (managed-released) package version installable by subscriber orgs",
    "Patch version addressing bug fixes on a released minor version without a new minor release",
    "Guidance on dependency declaration and upgrade path planning"
  ],
  "references": [
    "skills/devops/second-generation-managed-packages/references/examples.md",
    "skills/devops/second-generation-managed-packages/references/gotchas.md",
    "skills/devops/second-generation-managed-packages/references/llm-anti-patterns.md",
    "skills/devops/second-generation-managed-packages/references/well-architected.md"
  ],
  "scripts": [
    "skills/devops/second-generation-managed-packages/scripts/check_second_generation_managed_packages.py"
  ],
  "tags": [
    "2gp",
    "managed-package",
    "isv",
    "appexchange",
    "package-versioning",
    "dev-hub"
  ],
  "templates": [
    "skills/devops/second-generation-managed-packages/templates/second-generation-managed-packages-template.md"
  ],
  "updated": "2026-04-04",
  "vector_embedding": null,
  "version": "1.0.0"
}
