{
  "category": "admin",
  "chunk_ids": [
    "0594977cbc8a466f1dec",
    "098659d0a490ffc02ef9",
    "0f6bfbfcd52d5219c96f",
    "15499782280d7e1075e2",
    "1fe62d76afd51a57c588",
    "2f11f9e14a32e5e008d7",
    "3023bd8db2bf19e1585e",
    "31652ac3ba0475802e35",
    "34cee31e9588a271df96",
    "3686f0854103e5a3b2f8",
    "3e25149a353bd1bc7283",
    "3ffd2b3990f7e27df666",
    "46664be3b18f63986c16",
    "4dc4e87877ad4972db0a",
    "520e5b80f1e631cac607",
    "52af7b8f831203238305",
    "5a4322c05492c8716e90",
    "6959ad5ef10e9ad941da",
    "7869a9924dead1bcbcbe",
    "7884ec4e2b1f4dd7185b",
    "79f6b5fb606eb5133b36",
    "7a134812ae801d67ae28",
    "7e2823888edb161054de",
    "7f0a7f843a6e1964fb03",
    "7f8369a166668827eccb",
    "7f999a7b7087f2b30211",
    "838ae0928d4c4fe6d488",
    "8d3a78195ae157ee5bfc",
    "8dad4cc90d41553e934e",
    "8dd752c7b23768206df4",
    "8ddac4e705ec48e7ee2a",
    "95d471934a4edf6ad8ee",
    "98cf33f227af47b8dbb3",
    "9d52853a1b36187e43e1",
    "a20fd2f7375f67fb6eb7",
    "acd53c9d5f1a56222e14",
    "b00a6532bb8a70ef62d5",
    "bdac47528704b93b75e1",
    "c104b81a03eec8e81328",
    "c1acf17c605ca69470fa",
    "ca8c2f1d4a3513d1ae99",
    "ca9288d4e9ab303c87fb",
    "d1c5554b8c2ce6ca8fa7",
    "d76235baa7375634ddb0",
    "e172ae8d760ef8e7b8cb",
    "e19bfc0d089870f56a94",
    "e8a1d57de1a4942cdd4b",
    "f2301a34095806ab2781",
    "f750ca07957e557ca708",
    "fcae4775c8186cc351fb",
    "ff6e50ee61a4c07c4e15"
  ],
  "content_hash": "40a7a15d90e1a8e6ab68f1f12113d16a72bb94373be22f1ae730950406398c94",
  "dependencies": [],
  "description": "Use when designing, reviewing, or troubleshooting Salesforce duplicate prevention, matching rules, duplicate rules, and merge governance. Triggers: 'duplicate rule', 'matching rule', 'merge strategy', 'dedupe', 'survivorship', 'D&B', 'same contact twice'. NOT for choosing data-load tooling unless duplicate control is the main problem.",
  "file_location": "skills/admin/duplicate-management",
  "id": "admin/duplicate-management",
  "inputs": [
    "duplicate scenarios",
    "merge policy",
    "stewardship owners"
  ],
  "name": "duplicate-management",
  "official_sources": [
    "Salesforce Well-Architected Overview \u2014 data quality and stewardship framing",
    "Object Reference \u2014 object semantics that affect duplicate strategy and merge behavior",
    "Metadata API Developer Guide \u2014 duplicate and matching rule metadata deployment behavior"
  ],
  "outputs": [
    "duplicate strategy",
    "merge governance recommendations",
    "duplicate control findings"
  ],
  "references": [
    "skills/admin/duplicate-management/references/examples.md",
    "skills/admin/duplicate-management/references/gotchas.md",
    "skills/admin/duplicate-management/references/llm-anti-patterns.md",
    "skills/admin/duplicate-management/references/well-architected.md"
  ],
  "scripts": [
    "skills/admin/duplicate-management/scripts/check_duplicate_rules.py"
  ],
  "tags": [
    "duplicate-rules",
    "matching-rules",
    "merge",
    "survivorship",
    "data-quality"
  ],
  "templates": [
    "skills/admin/duplicate-management/templates/duplicate-governance-template.md"
  ],
  "updated": "2026-03-13",
  "vector_embedding": null,
  "version": "1.0.0"
}
