{
  "category": "apex",
  "chunk_ids": [
    "045f2cf4b97666698edf",
    "0b4f51b5789308568dc6",
    "1093f899eb955491db9d",
    "10c2d7630afa93104afa",
    "12c51fb2be2c753bb457",
    "150433cb90fbbb1828f7",
    "185e71683d1fb7554f53",
    "188af5eebaadc8de68b2",
    "1bc9a75a82a2d89f6ea0",
    "1c932d1657e1dbb43fd0",
    "1dae99ee70d73dfd2739",
    "20fd902aa00727a75fee",
    "291b1f76e62aa6edf95b",
    "2d1125591b75dd5a28b4",
    "2fa7831d388e4b40b4ac",
    "2fd4feb8dfb63658f85f",
    "30019d7af5f8778c75d1",
    "32538b1b8982b60eab98",
    "345e65f218845b1cf85f",
    "34ec5e297c78ce82bcb3",
    "3973fb0bb261c4238919",
    "39d2dd4af4820a3e863b",
    "427aed0df3c6765245fa",
    "42854ed97188c6a0c466",
    "4621025465ccf15a8b6a",
    "502352f8d927a1c02595",
    "52bc548ad70b3c2aa356",
    "53150479e71f97dcc5d2",
    "53b8c739e27f502fe80c",
    "5468ef84a1e088fc6483",
    "55a6b8c26fd3c687e5ac",
    "5826ba63f449d4b7601d",
    "5a4372655291f8419bfd",
    "5b0de4c895f4c0072524",
    "5c9180be2662f7bf79f0",
    "62a79a3d6e8f4857f8a4",
    "639342e86c764ca8751b",
    "63fd3e857130f1cdc98d",
    "65d22ff86dfe9f09a491",
    "66746c9f6ca9fd688edc",
    "66f76e2e0ad38c61559e",
    "6751d0827d4234b0bd5d",
    "695b69506a204df0409e",
    "69d62fec57204f445bb0",
    "6d1f76c7fffce9be26da",
    "7010ffd782f370937c4a",
    "7611e14a9ac7917a9a6f",
    "7997ba50bec43a366e21",
    "7a4d659aceb4f2c8e71a",
    "7a87c8760642fbc28e6d",
    "7d51e537fca61b653591",
    "7f3714411d5cc5b858e2",
    "8bb09b2adc331756295c",
    "8bc8ba35b3d52c551ad0",
    "8ceb70c179f67798ebce",
    "90ae1256326c9f80e48b",
    "90cd913f65fdde4779e7",
    "9257689beb996d8309aa",
    "952f7392337d0cb3bfee",
    "9707c5322f1224184b73",
    "9919a52767d0d478180e",
    "9b0c71cbee6ac4ff1b0a",
    "9d4ef2c183ae7e6135bf",
    "a3aa64b38092c8217b72",
    "a5c0045498a939c36bd6",
    "a84345b337c978ae8129",
    "aa89174675b328b7a7f3",
    "b0b506e28bd3867af209",
    "b172fc16b9c3ad1c1151",
    "b21a058c405161d8a2cc",
    "b5abf3a49e6407b87de4",
    "c3153cdbf7110cddbbfe",
    "c3180ed3e818ff4320d7",
    "c3314df8c8aee0ece5ba",
    "c63353c53fc8c3bdc089",
    "c8e2436ea72080f1e82e",
    "ce31c8bd9dc23e9d538a",
    "ce3943be10d8395d2fce",
    "d5279528c8955e4965c7",
    "dfd5834fe32e45103a39",
    "e700862abba0288ae935",
    "e7712d5a9af64c752d7c",
    "e7ea4275fa64fcc55ec3",
    "ea310927e855a306a2d0",
    "ef081143cac8d31ca866",
    "f0785371b5ed6e503637",
    "f564cf2afee0b02d5065",
    "f6b12922888eae17d7bb",
    "f8bbfc42b7461c33d942",
    "f9824720fbf2724e3f5e"
  ],
  "content_hash": "5866314673ce8ee6d8f0743607a2db65e28fd71e537a719b2b1667637ece6985",
  "dependencies": [],
  "description": "Use when diagnosing SOQL performance problems caused by formula fields, hitting formula compile-size limits, or deciding whether to replace a formula field with a stored field for indexing. Triggers: 'formula field slowing SOQL', 'compile size limit', 'cross-object formula spanning limit', 'formula field not indexable', 'LDV query full table scan', 'SOQL WHERE on formula'. NOT for formula syntax help, building formula expressions, or authoring new formulas from scratch \u2014 use admin/formula-fields for that.",
  "file_location": "skills/apex/formula-field-performance-and-limits",
  "id": "apex/formula-field-performance-and-limits",
  "inputs": [
    "Object name and the formula field(s) suspected of causing the problem",
    "SOQL query text or debug log excerpt showing slow execution or full table scan",
    "Approximate record volume on the object (LDV threshold is typically 1M+ records)",
    "Whether the formula includes cross-object references (lookup traversals)"
  ],
  "name": "formula-field-performance-and-limits",
  "official_sources": [
    "Salesforce Help \u2014 Formula Field Limits and Considerations \u2014 https://help.salesforce.com/s/articleView?id=sf.formula_limits.htm",
    "Salesforce Help \u2014 Operators and Functions: Formula Size Limits \u2014 https://help.salesforce.com/s/articleView?id=sf.customize_functions.htm",
    "Apex Developer Guide \u2014 https://developer.salesforce.com/docs/atlas.en-us.apexcode.meta/apexcode/apex_dev_guide.htm",
    "Apex Reference Guide \u2014 https://developer.salesforce.com/docs/atlas.en-us.apexref.meta/apexref/apex_ref_guide.htm",
    "Salesforce Well-Architected Overview \u2014 https://architect.salesforce.com/docs/architect/well-architected/guide/overview.html",
    "Salesforce Help \u2014 Improve Report Performance with Large Data Volumes \u2014 https://help.salesforce.com/s/articleView?id=sf.reports_perf_large_data_volumes.htm"
  ],
  "outputs": [
    "Assessment of whether the formula field is causing a full table scan in SOQL",
    "Recommendation to convert formula to a stored field and keep it in sync via Flow/Process",
    "List of formula compile-size and cross-object spanning violations if present",
    "Revised SOQL or schema design that uses an indexed stored field instead"
  ],
  "references": [
    "skills/apex/formula-field-performance-and-limits/references/examples.md",
    "skills/apex/formula-field-performance-and-limits/references/gotchas.md",
    "skills/apex/formula-field-performance-and-limits/references/llm-anti-patterns.md",
    "skills/apex/formula-field-performance-and-limits/references/well-architected.md"
  ],
  "scripts": [
    "skills/apex/formula-field-performance-and-limits/scripts/check_formula_field_performance_and_limits.py"
  ],
  "tags": [
    "formula-fields",
    "performance",
    "soql",
    "ldv",
    "indexing",
    "governor-limits",
    "large-data-volumes"
  ],
  "templates": [
    "skills/apex/formula-field-performance-and-limits/templates/formula-field-performance-and-limits-template.md"
  ],
  "updated": "2026-04-06",
  "vector_embedding": null,
  "version": "1.0.0"
}
