{
  "category": "data",
  "chunk_ids": [
    "0022504e926096d8f7fe",
    "0023e140bfa63e3713bf",
    "015786aa1d95e9f67e52",
    "023f19c20da05806fb6e",
    "0cd60af5274e19be8829",
    "10de3c657b3758316d23",
    "163d18b8e4a64351fea4",
    "1818cbcc8772bf250df8",
    "1a501c1587cd729e35f5",
    "1af91154ff1bc50a8534",
    "1b3a3670abcd03a86071",
    "1d8da5e09bef40213f9d",
    "1df471ce365150e964d3",
    "255cd6979f892f26f00a",
    "29a7349647b845387c4f",
    "2deb7e80141cc86e5152",
    "334871a32c47e498fc8c",
    "34c4410bd5434991427a",
    "36f20d03927ed37bfa32",
    "3790d54a00f68e2f5452",
    "381673c1e0a3b46c6b46",
    "396200a207eb38a8538a",
    "49d49d5d053aba5b66dd",
    "4a3f6f0fafaee87ab9c8",
    "4ab38f97e63278a03525",
    "4c07116b734b405724a8",
    "4c5da73612200ba075ad",
    "4e877349f625e00e80ed",
    "546749fa4e8967b2786a",
    "56732364294f8fb09401",
    "5f143def57c3ca0e3fab",
    "604eced2ff17b32ca07e",
    "61aab41330793ffa0ea3",
    "61f07d235c5ad8201932",
    "63f540f2e86a23cb804a",
    "64053336fbdb7b8ebf7f",
    "6a461967234098f225a5",
    "6c624ce6ecc13d352066",
    "7042166ccf1d96e4a9bc",
    "7a300ddf1f8ac1dbc3fe",
    "7cc3df163181813810e4",
    "8185042f4a7a839cde58",
    "81f310d2e5886da5cdb7",
    "8659f0b27fd9cc5c90f9",
    "888eae5669bd71a792f0",
    "8896a90276758b6f5f62",
    "97a5d034151db13758c1",
    "9bac4ea448a0fe103319",
    "9d24f8a137ed99ea7b9c",
    "9dd2538af2f5c9cd1e82",
    "9ddb9e67791f4f4ae90d",
    "9f570b557687bc10f174",
    "a167aa25f3972e349c1b",
    "a5a2dddf262c4368318b",
    "a86a9c155aa6a65c9db0",
    "ab11e11acafc088f5e1d",
    "afb8a9c73b0bb837c381",
    "b153ccaf311ef9265c40",
    "b6cfd1bf1d3e2ea270ec",
    "b6f16502ad0b55f1c917",
    "b752813d6b35678467fc",
    "be026e5162ce5d19db0f",
    "c7615b2533f558af9e85",
    "ce6e8385be69aca7cf4c",
    "d0de60db71146833bd09",
    "d56077915c69f52927ce",
    "d59871da19af13b76f8f",
    "d6e020625b005fec1234",
    "d72afb1298d4714afae8",
    "d751e893ec86a22c57dd",
    "d9407144099ba3923343",
    "dccbf9bc7aec2e3ac43a",
    "ddf962fd87bfc3452167",
    "debe49d9a6e4b266f9d6",
    "dec6c30533f1e0b3a31a",
    "dfd0f829e129966c5139",
    "e2ddfc76607fc0b68cf8",
    "f489b798c23fcf646893",
    "f50c62ea9069852f211b",
    "f57d15fdc74af68c5c58",
    "f8ae1dc33f4959f917b6",
    "f8e49a9031663dd1e6f9",
    "f9f88f50bbb79209d904"
  ],
  "content_hash": "09ebf66e5ab21e0ec3698310123a2a03e2b8f1222c51613ea5db852e6aa05e00",
  "dependencies": [],
  "description": "Use when scheduling automated deletion of temporary records, enforcing data retention policies, running nightly cleanup jobs, reclaiming org storage, managing recycle bin, or performing async bulk deletion of aged records. Trigger keywords: batch delete, retention policy, purge records, cleanup job, recycle bin, emptyRecycleBin, hard delete, nightly purge, storage optimization. NOT for data archival to external storage (use data-archival-strategies).",
  "file_location": "skills/data/batch-data-cleanup-patterns",
  "id": "data/batch-data-cleanup-patterns",
  "inputs": [
    "Object API name and retention period (e.g., purge records older than 30 days)",
    "Whether permanent deletion (hard delete / emptyRecycleBin) is required",
    "Expected record volume \u2014 determines batch size and chunking strategy",
    "Cascade deletion risk: master-detail child objects that auto-delete with parent"
  ],
  "name": "batch-data-cleanup-patterns",
  "official_sources": [
    "Apex Developer Guide \u2014 Batch Apex (`Database.Batchable`), `Database.delete()` allOrNone behavior, `Database.emptyRecycleBin()`, Schedulable interface, `System.schedule()` cron syntax",
    "Apex Reference Guide \u2014 `Database.emptyRecycleBin()` method signature, `Database.DeleteResult` class, governor limits for DML operations",
    "Bulk API 2.0 Developer Guide \u2014 HARD_DELETE operation, ingest job lifecycle, permissions required for hard delete",
    "Salesforce Well-Architected Overview \u2014 Operational Excellence pillar framing, reliability and scalability guidance"
  ],
  "outputs": [
    "Batch Apex class implementing Database.Batchable<SObject> with retention filter",
    "Schedulable wrapper class with System.schedule() cron expression",
    "Optional emptyRecycleBin() call in finish() for immediate storage reclaim",
    "Error log or custom object record capturing partial-delete failures"
  ],
  "references": [
    "skills/data/batch-data-cleanup-patterns/references/examples.md",
    "skills/data/batch-data-cleanup-patterns/references/gotchas.md",
    "skills/data/batch-data-cleanup-patterns/references/llm-anti-patterns.md",
    "skills/data/batch-data-cleanup-patterns/references/well-architected.md"
  ],
  "scripts": [
    "skills/data/batch-data-cleanup-patterns/scripts/check_batch_data_cleanup_patterns.py",
    "skills/data/batch-data-cleanup-patterns/scripts/check_data_cleanup.py"
  ],
  "tags": [
    "batch-apex",
    "deletion",
    "retention-policy",
    "recycle-bin",
    "storage-optimization",
    "scheduler",
    "hard-delete",
    "data-cleanup"
  ],
  "templates": [
    "skills/data/batch-data-cleanup-patterns/templates/batch-data-cleanup-patterns-template.md"
  ],
  "updated": "2026-04-04",
  "vector_embedding": null,
  "version": "1.0.0"
}
