{
  "category": "devops",
  "chunk_ids": [
    "001fc52172e3de4801ef",
    "01cc4a81f87400c1e675",
    "02cbee9f8ed4cd759f9e",
    "04cf6c4f7bde86df83c5",
    "051c2ad725c5e6af8c6a",
    "05f58b4f4125982249f8",
    "07ecd87717eedd09f689",
    "087e17fecd6350bf9c36",
    "0b359d2456f1214b9af6",
    "0b8021ac7ca38ea44dbd",
    "15575824479a5cf8f6f8",
    "1a705f676d6d74cb6f62",
    "1c511e9105a87a51ac11",
    "1de4761c7d7af2193c8a",
    "1e630f4043f4dcb0e8c3",
    "230c21f7b47fb7655e8d",
    "2343455ef4a800484330",
    "236b3fa6d605c75b2359",
    "269594652430cd8908de",
    "299f00ca9dd0c307c42c",
    "2a9de426288d78f1a130",
    "2f9820e3eb00994dbee9",
    "30c3f88afa22da5d1423",
    "3652d9f4cdce2ebd2f40",
    "394b294a3825fca26a21",
    "3c65209840b64fd01b29",
    "412d2c67811283691631",
    "48e241489aa24b20cb8a",
    "4a3bfbb6de88240da276",
    "4d13b239e3e50be804f4",
    "4e95d49b35695097d40a",
    "506bb125f1e2149c70f0",
    "5313679fb7b6f7928e60",
    "583a71a0e51be20a1433",
    "62f3992b0f39dfaa9496",
    "665a019608023e0b3999",
    "677629524b61ccb800bb",
    "678c0a84dea04a4e33b9",
    "69be70f55cfe0b07fd15",
    "7c8d152c316d400b2641",
    "7d31720a34ae17bfd625",
    "80099f783c9fe5361b30",
    "80447708c93cbca7c854",
    "81351ee603d0227ae731",
    "9001db6ee113a0e39ac9",
    "9049a17603b4a1935514",
    "9504703867140a22b4bd",
    "98b64f32d4bf36dfe0bd",
    "9a6844c43829c053cde8",
    "a0122ea9039200107ca3",
    "a6d167e975e20f280a90",
    "ac61e71f5a5152934dc4",
    "aed40b35479228ac2c11",
    "b013ecb0973555abc68d",
    "b4fd75b690defda90650",
    "ba604bb403fe44ffcce5",
    "bd287788ba03133964eb",
    "c0c3754c35596a8eef99",
    "c17a3b7892a8aeb241fa",
    "c1c9df8bf3ba6398d4d8",
    "c47f96629ad27aef0466",
    "c6fd6d50448f2112ad79",
    "d7af62394da3374cfba3",
    "d9b963169e537aeb52a5",
    "ddcc34f85fc740fd2499",
    "df8d0ff3d6f5ae523b63",
    "dfac92516c564a334d3b",
    "dfb9a97265ecdeb39c44",
    "e13c81596277a8ef6217",
    "e76465b892ced87b569c",
    "e7c3b6108c9393943d64",
    "e9cf14cf9767ca442d94",
    "f25bbe02442b2eddcce6",
    "f39428125c5bf09d434c",
    "f64658d4c093a1a86c2d",
    "fcc249f644e1fb6b8562",
    "fcedb498e1f78a7bfecf",
    "fdbe40c90e6ef0404a29"
  ],
  "content_hash": "869e3c6f1a9cf642d3856f786da9a1e551912ab96f44153179c6b1bf753d32f7",
  "dependencies": [],
  "description": "Use when building or maintaining automated end-to-end regression tests for Salesforce UI (Lightning, LWC, Aura, Flows), selecting a testing framework (UTAM, Provar, Selenium), handling Shadow DOM challenges, or scheduling regression suites against pre-release orgs. Triggers: 'UTAM page objects', 'Shadow DOM testing', 'Salesforce E2E regression', 'Provar test automation', 'pre-release regression window'. NOT for Apex unit testing, LWC Jest component testing, manual UAT planning, or Agentforce conversational testing.",
  "file_location": "skills/devops/automated-regression-testing",
  "id": "devops/automated-regression-testing",
  "inputs": [
    "testing framework preference or constraint (UTAM, Provar, Selenium, Playwright)",
    "Salesforce edition and org type (sandbox, scratch, pre-release)",
    "UI technology in use (LWC, Aura, Visualforce, hybrid)",
    "CI/CD platform and pipeline configuration",
    "critical business processes that require regression coverage"
  ],
  "name": "automated-regression-testing",
  "official_sources": [
    "Salesforce Well-Architected Overview \u2014 architecture quality framing for reliability and adaptability pillars",
    "UTAM Developer Guide \u2014 page object model framework for Shadow DOM traversal and LWC testing",
    "Salesforce DX Developer Guide \u2014 scratch org configuration, sandbox management, CLI-based testing workflows",
    "Salesforce Developers Blog \u2014 UTAM adoption patterns, Shadow DOM testing strategies",
    "Lightning Web Components Developer Guide \u2014 Shadow DOM behavior, Locker Service, Lightning Web Security"
  ],
  "outputs": [
    "regression test framework selection rationale and setup guide",
    "page object model architecture for Salesforce Lightning pages",
    "pre-release regression schedule aligned to Salesforce tri-annual release cycle",
    "CI pipeline configuration for headless browser regression execution"
  ],
  "references": [
    "skills/devops/automated-regression-testing/references/examples.md",
    "skills/devops/automated-regression-testing/references/gotchas.md",
    "skills/devops/automated-regression-testing/references/llm-anti-patterns.md",
    "skills/devops/automated-regression-testing/references/well-architected.md"
  ],
  "scripts": [
    "skills/devops/automated-regression-testing/scripts/check_automated_regression_testing.py"
  ],
  "tags": [
    "automated-regression-testing",
    "utam",
    "shadow-dom",
    "e2e-testing",
    "selenium",
    "provar",
    "pre-release-testing",
    "ui-automation"
  ],
  "templates": [
    "skills/devops/automated-regression-testing/templates/automated-regression-testing-template.md"
  ],
  "updated": "2026-04-05",
  "vector_embedding": null,
  "version": "1.0.0"
}
