{
  "category": "apex",
  "chunk_ids": [
    "023bc4dffef245fedf3d",
    "052ee8354aa6350e35b1",
    "07fed7ee8ccd906a9647",
    "0e330e0180e3d3f6b6b4",
    "13fbce242979aae2fa57",
    "1612880f2e207c07ca41",
    "176dcfbe374e7d45153c",
    "1a5f60d9540aed7d84cb",
    "1cf2b06c8a3eac532bfa",
    "1f054c8c21213e3896a0",
    "24bfa6da03d3666924e1",
    "290bb4c91fad21e9627a",
    "2a9d9da5a6d5cc186b54",
    "32123e7a11fcac973bc8",
    "36b7dd35e3ed67f156ef",
    "39078ffe96ac6a4ab926",
    "3fd1f3487ed275fe2f10",
    "43e5d09de482aa53abcf",
    "447ae6afad424935de51",
    "474b33602b9c62abc43d",
    "4864c269656b93968ab2",
    "4d1c6ec56e5aa32ac2ec",
    "511a930f73304bde0e2b",
    "52ecfff20d440350ea4e",
    "54783db3bc9a839da889",
    "54cb7f4de4ef8bf6755c",
    "56b7c9126952904ea8f4",
    "57493aa22a57e124e4ee",
    "597c2126bf7518ac62e2",
    "5f65ac38c9309800b28f",
    "6811b07a7ab00eaaef21",
    "6b3b9f51450201739c3e",
    "6ba16c6002571822516e",
    "6d02f898b4517f77d3bd",
    "703c56203f49519ed8f0",
    "70d2cfa981652d7d648f",
    "72c006f0b9eb8aecfb9c",
    "7538278a49474895b6ee",
    "75e66a5dd6205cc4be13",
    "7efd0ab8b646bbe53c54",
    "82fa9b0802138a4a3727",
    "84d1d7c5e27a5a43628c",
    "8cb30da08e955f10fbb5",
    "903e58da943be64be3be",
    "907086ef546cdc34ddfb",
    "932a0adf1b82ff23eb28",
    "960c377c14652b16472f",
    "97ef4183e45172f866f3",
    "9ad74e65a9444bb82812",
    "a17821e48e9dc76f3004",
    "a1cdcbef91e241351ae7",
    "a4afe27e5b105e2c8400",
    "a5ce31067dff367d103b",
    "a649fa0ea158b540e34f",
    "a8ee94565c13ed02ba67",
    "ae644afc8c57b25e16a2",
    "aef9a480c7c09fa2293b",
    "af7cc96b5aa9fc2e8c50",
    "b6c8ee374d440a6b4327",
    "bc9a8d41198f68c155b1",
    "bc9f01bc079f77283eaf",
    "bdb6aca350590896a4c0",
    "c2fc29d13b899a85e11b",
    "ca601de3b5433d415d60",
    "cb929161bc5c49996a6b",
    "cbb313f9fb16b4f83e7b",
    "d3bf98421f41890bfb0f",
    "d3d98b91d71f837c5301",
    "d50cbceb2c6d35b01882",
    "d65a6e31e2dea6fd3d7d",
    "d7c8a80c1017185c96d1",
    "db9ab1adbb7f45a9a2af",
    "de4cbd500e26b3be3481",
    "e24b7fe28a5e0976cccd",
    "e3e8badc37a3ba4b29f8",
    "e46bd64cfba13f76a87f",
    "f0a0c737e6f6fe7ec435",
    "f180db5acf51628e2925",
    "f1b078455051b397fff7",
    "f2de1ab219da8375c98f",
    "f9da2fde5876327da8a9"
  ],
  "content_hash": "b750cd0d1792345b1f6b62b5bcb978e681033ac360bd6f456c7c2e69a18293f1",
  "dependencies": [],
  "description": "Customizing Salesforce Quote PDFs using Visualforce: custom VF-based quote templates, dynamic section rendering, multi-language layouts, logo placement via static resources, and programmatic PDF generation with PageReference.getContentAsPDF(). Use when standard declarative quote templates are insufficient or when CPQ/OmniStudio is not licensed. NOT for LWC-based document generation (use omnistudio/document-generation-omnistudio). NOT for OmniStudio DocGen templates. NOT for standard quote template drag-and-drop editor.",
  "file_location": "skills/apex/quote-pdf-customization",
  "id": "apex/quote-pdf-customization",
  "inputs": [
    "Quote record Id or SBQQ__Quote__c Id (for CPQ) \u2014 which object drives the template",
    "Required line items: standard QuoteLineItem or custom object",
    "Branding assets: logo image, fonts, color palette \u2014 whether hosted as static resources",
    "Locale/language requirements: single-language or multi-language per customer",
    "Delivery mechanism: rendered inline, emailed as attachment, or stored as ContentDocument"
  ],
  "name": "quote-pdf-customization",
  "official_sources": [
    "Visualforce Developer Guide: Rendering a Page as PDF \u2014 https://developer.salesforce.com/docs/atlas.en-us.pages.meta/pages/pages_output_pdf_content_type.htm",
    "Visualforce Developer Guide: PDF Rendering Considerations \u2014 https://developer.salesforce.com/docs/atlas.en-us.pages.meta/pages/pages_output_pdf_considerations.htm",
    "Apex Developer Guide: PageReference Class \u2014 https://developer.salesforce.com/docs/atlas.en-us.apexcode.meta/apexcode/apex_System_PageReference.htm",
    "Apex Reference Guide: PageReference.getContentAsPDF() \u2014 https://developer.salesforce.com/docs/atlas.en-us.apexref.meta/apexref/apex_System_PageReference_getContentAsPDF.htm",
    "Salesforce Help: Quote Templates \u2014 https://help.salesforce.com/s/articleView?id=sf.quotes_templates.htm",
    "Salesforce Well-Architected Overview \u2014 https://architect.salesforce.com/docs/architect/well-architected/guide/overview.html",
    "Apex Developer Guide \u2014 https://developer.salesforce.com/docs/atlas.en-us.apexcode.meta/apexcode/apex_dev_guide.htm",
    "Apex Reference Guide \u2014 https://developer.salesforce.com/docs/atlas.en-us.apexref.meta/apexref/apex_ref_guide.htm"
  ],
  "outputs": [
    "Visualforce page (.page) with renderAs='pdf' and correct apex:page controller binding",
    "Apex controller or extension class retrieving Quote + QuoteLineItem data with FLS enforcement",
    "Static resource references for logo and CSS using absolute URLs",
    "PageReference.getContentAsPDF() snippet for programmatic generation and attachment",
    "Conditional section logic for dynamic layouts (discounts, multi-currency, language)"
  ],
  "references": [
    "skills/apex/quote-pdf-customization/references/examples.md",
    "skills/apex/quote-pdf-customization/references/gotchas.md",
    "skills/apex/quote-pdf-customization/references/llm-anti-patterns.md",
    "skills/apex/quote-pdf-customization/references/well-architected.md"
  ],
  "scripts": [
    "skills/apex/quote-pdf-customization/scripts/check_quote_pdf_customization.py"
  ],
  "tags": [
    "quote-pdf",
    "visualforce",
    "pdf-rendering",
    "quote-template",
    "renderAs-pdf",
    "pageReference",
    "static-resource",
    "multi-language"
  ],
  "templates": [
    "skills/apex/quote-pdf-customization/templates/quote-pdf-customization-template.md"
  ],
  "updated": "2026-04-06",
  "vector_embedding": null,
  "version": "1.0.0"
}
