{
  "category": "admin",
  "chunk_ids": [
    "015b8bb5a02fe0d06257",
    "01f954eae1326ba8518d",
    "026e5836941669d1ff7e",
    "03d28cbd71fa3d21607a",
    "09265fc797a6d49685c8",
    "0aea196686a73e3b92c2",
    "0d3468ec3d90902ebb77",
    "0d4ed6fabd9198959e93",
    "183a651b57628219cecb",
    "19e5d7934c9dc9768e0e",
    "19f56d6dae14cf3b09cb",
    "1a056123d675b2f152e1",
    "1ec7f20e4272cb3efa44",
    "21c83eb1101f62c7dcc1",
    "28ebecea9776bfd71e78",
    "29956cf8e4f721dbaa0e",
    "2b38aab430050ea91ea3",
    "2f4d67d42c0ca8f08bae",
    "2f52a1737030173af446",
    "358a4d5f01c45f8087ec",
    "35f617b6f66001c99ab1",
    "3ef04553617daee05ce9",
    "4ade11c6c446c4a745ac",
    "4ae52411d9291b546286",
    "4bc1aa07a38071f00b99",
    "4d7b04adf81a4acbc3cb",
    "50d41ffb5080f143cd4a",
    "57af0043e37a5df0dd73",
    "5e24098bcaa79a83f56f",
    "5ee1eb84c8780b0998eb",
    "6749b639cf73e185dc7f",
    "69877599447f82fe94a9",
    "70904a5f1456c3b575bb",
    "7121eb881d6c754bad24",
    "71811e9a51b0ab212b6a",
    "750b42d54c2c2c6c76fb",
    "785d7a7c22cb786d4150",
    "78a80c518193efc5aa79",
    "7e8ff125a73dfc94cb64",
    "810de03183b004775535",
    "83aeb59fbf94ad4c7b4b",
    "8783dd00703ffdda906f",
    "89e472a326ec6c1e99e3",
    "8a4eb2aa7aa122f4056d",
    "8b105b255d9df5f9fa1a",
    "8d2f323b407f8760baf4",
    "91e4874208f3cbfb0cf6",
    "98b39b92fe83dea03832",
    "9dc201474e428906052f",
    "a1931c20f3709bc8a3e4",
    "a8c5c6aca1794f13686f",
    "a9033bafc95b90dd6039",
    "aa38a7c2539bce142a0d",
    "acca7736b829c66fcfde",
    "ad409d5f2884e73e6044",
    "b60a8800649c4472d4ae",
    "b9af346a4e9a8fcf7f63",
    "ba469fe5d72de9705670",
    "bcb596582d69e0048428",
    "c1c3404cacccf2f03a3f",
    "c1f57ccc38ccccd41f44",
    "c28d81231bb8b2cee966",
    "c6d0febf92e6345414f4",
    "d1d830631a6368fe3c18",
    "d229ce0ff13418119583",
    "d7addbd611b32bef9911",
    "dba0329f4b8b3aba9675",
    "de36ecdef30346524858",
    "e07d28708bfd762f82d0",
    "e3e028dfa5178b825f60",
    "e405c77853ce1ea10004",
    "e42995a942520a9a9676",
    "ea2fa53f5fc13182053a",
    "eb912b25f444b97ad8a9",
    "efbeea5cb6a5d3dfaec6",
    "f1f0aafdaeb21f2ad009",
    "f42ebfa84123b8549b4d",
    "fa3cbea53d5e1be25b60",
    "fd57c5d8e0f241bbbed5"
  ],
  "content_hash": "76cff0970d70b9c624d86fbd1fd2b705c93bd62b452baf545270a1bd8dbe3d7f",
  "dependencies": [
    "omni-channel-routing"
  ],
  "description": "Use this skill when setting up Service Cloud Voice with Amazon Connect \u2014 provisioning the contact center, configuring phone numbers, enabling real-time transcription, and configuring After Conversation Work Time. NOT for CTI adapter development, Open CTI customization, or custom Amazon Connect Lambda development outside the guided wizard.",
  "file_location": "skills/admin/service-cloud-voice-setup",
  "id": "admin/service-cloud-voice-setup",
  "inputs": [
    "Salesforce org with Service Cloud Voice add-on license assigned",
    "Contact Center permission set assignments for admins and agents",
    "Custom domain configured in the org (My Domain)",
    "Omni-Channel enabled in the org",
    "AWS account credentials if bringing an existing Amazon Connect instance (optional)"
  ],
  "name": "service-cloud-voice-setup",
  "official_sources": [
    "Set Up Service Cloud Voice with Amazon Connect \u2014 https://help.salesforce.com/s/articleView?id=sf.voice_setup_amazon_connect.htm",
    "Configure Call Transcription \u2014 https://help.salesforce.com/s/articleView?id=sf.voice_transcription_setup.htm",
    "Configure After Conversation Work Time \u2014 https://help.salesforce.com/s/articleView?id=sf.voice_acw_setup.htm",
    "Service Cloud Voice Best Practices Guide \u2014 https://help.salesforce.com/s/articleView?id=sf.voice_best_practices.htm",
    "Service Cloud Voice Overview \u2014 https://help.salesforce.com/s/articleView?id=sf.voice_overview.htm",
    "Salesforce Well-Architected Overview \u2014 https://architect.salesforce.com/docs/architect/well-architected/guide/overview.html"
  ],
  "outputs": [
    "Provisioned Amazon Connect contact center instance linked to Salesforce",
    "Voice service channel in Omni-Channel routing configuration",
    "Phone number(s) claimed and assigned to contact flows",
    "Real-time transcription enabled (if required)",
    "After Conversation Work Time presence status configured",
    "Agents able to handle voice calls from the Service Console"
  ],
  "references": [
    "skills/admin/service-cloud-voice-setup/references/examples.md",
    "skills/admin/service-cloud-voice-setup/references/gotchas.md",
    "skills/admin/service-cloud-voice-setup/references/llm-anti-patterns.md",
    "skills/admin/service-cloud-voice-setup/references/well-architected.md"
  ],
  "scripts": [
    "skills/admin/service-cloud-voice-setup/scripts/check_service_cloud_voice_setup.py"
  ],
  "tags": [
    "service-cloud-voice",
    "amazon-connect",
    "omni-channel",
    "telephony",
    "call-transcription",
    "after-conversation-work",
    "contact-center"
  ],
  "templates": [
    "skills/admin/service-cloud-voice-setup/templates/service-cloud-voice-setup-template.md"
  ],
  "updated": "2026-04-06",
  "vector_embedding": null,
  "version": "1.0.0"
}
