{
  "category": "apex",
  "chunk_ids": [
    "029dfe7d866deaa303be",
    "0a46576b955a2fd60109",
    "0a5a315911d6a54fcf3d",
    "0de54f29d0f1b140af2e",
    "0e4ae476d83b64db949b",
    "1fb12d922487765d2c64",
    "20fbc227962194aee9cb",
    "23099556465e75f8775a",
    "274ceca189b8ceb0f0d4",
    "2a5b9d872d9d44a66994",
    "2cd7a69a74349c99881c",
    "2d080008d78bc1ce7842",
    "2edc10d27a4f70ff2ae8",
    "304085e8be749ee2d233",
    "33617d86d021f4565c81",
    "33a7cd1471f31ab069f6",
    "385111d3983d2877f68c",
    "38dba6667076ddbdf63c",
    "3d2b1c50952cc6f10f88",
    "3f17e9a9691b4b50af79",
    "4734beebbdbae7a48119",
    "477bb025d9fd4f7b0d79",
    "47b3ce528cf4940ab36d",
    "4a7b28b86acd26942889",
    "4a862bc2e8a28058fbe3",
    "53dd8d51c3ed920ce03c",
    "551aac813c3f54136507",
    "564138d69cfe12e5e7d1",
    "595fee222a01d483398a",
    "5abe845fd2593a2d16b4",
    "5bf1074832a715caed43",
    "5bf5ab8934595403318f",
    "60b023acfe2150917252",
    "6f82811f9ccf05021e62",
    "6fecc958658a594f1589",
    "7819b4c264f582060a0e",
    "7d51a798322acade7713",
    "80130bf73e26ad421b00",
    "821bb4d064ef4d5a727c",
    "845a0a0729669ab293ac",
    "8603c2d2cbd9ad7f2c58",
    "8aedb6eb2f9ad9f76a48",
    "8d01ab60b6ce33e18829",
    "8f5095ea97287cca54e1",
    "92cf1b4976ee9e7fd021",
    "9595bb6c63224570c857",
    "990b5e314ddaa005f0a8",
    "99db9c497071b94c74be",
    "a48133fb08c5a92a56b2",
    "a48b2e2a5fe809c878da",
    "ae2bcf810561d346c179",
    "b01fa6ea4e0f740d6c78",
    "b42d1f06cb9ab6d50796",
    "b486804f9f376e9c7226",
    "b85ea150f94650c13f07",
    "b9bdd79e45f4111ac8c9",
    "c1b155cf7f04570215c8",
    "c329686ba08904cf555e",
    "c91f2f2b32bfec85a1d5",
    "cedca726fe0c398559b5",
    "d64986f552f7a7287498",
    "deb347aaea9a3d9d5ced",
    "e55f1364a94da62c7707",
    "e7d659d4690244d4b832",
    "ead9ab3ae6c9b519b8bf",
    "ee08db1f4dad5c4eba70",
    "eef5fe6530317762a24b",
    "f2a25570bce66cb7c67d",
    "f409f50f6e36c73c4efe",
    "f5cda1ab40476ff99943",
    "f7bdfad7e768d4041934",
    "f83bec7a3b89c7179cde",
    "fcfd592527ecc856a445",
    "fe345b383d5cca199a00",
    "ffaa0d61c170ee473f4c"
  ],
  "content_hash": "204eaae72655769df523fa38c5299d753debd328ae2e66bf72aebdf119e79624",
  "dependencies": [],
  "description": "Governance patterns for orgs where Apex triggers and record-triggered Flows both run on the same object. Covers field-write conflict prevention, single-entry-point consolidation, recursion guards across automation types, and automation inventory documentation. Use when inheriting a mixed-automation org, adding a Flow to an object that already has triggers, or resolving silent field-overwrite bugs. NOT for order-of-execution mechanics (use order-of-execution-deep-dive). NOT for trigger handler framework design (use trigger-framework). NOT for Flow-only design patterns (use record-triggered-flow-patterns).",
  "file_location": "skills/apex/trigger-and-flow-coexistence",
  "id": "apex/trigger-and-flow-coexistence",
  "inputs": [
    "Object name and list of all active automations (triggers, flows, workflow rules, process builder)",
    "Description of the field-write conflict or recursion symptom",
    "Whether the org has a single-trigger-per-object pattern or multiple triggers"
  ],
  "name": "trigger-and-flow-coexistence",
  "official_sources": [
    "Apex Developer Guide: Triggers and Order of Execution \u2014 https://developer.salesforce.com/docs/atlas.en-us.apexcode.meta/apexcode/apex_triggers_order_of_execution.htm",
    "Salesforce Help: Record-Triggered Automation Decision Guide \u2014 https://help.salesforce.com/s/articleView?id=sf.flow_concepts_trigger.htm",
    "Salesforce Architects: Well-Architected Overview \u2014 https://architect.salesforce.com/well-architected/overview",
    "Salesforce Help: Flow Trigger Explorer \u2014 https://help.salesforce.com/s/articleView?id=sf.flow_trigger_explorer.htm",
    "Apex Developer Guide \u2014 https://developer.salesforce.com/docs/atlas.en-us.apexcode.meta/apexcode/apex_dev_guide.htm"
  ],
  "outputs": [
    "Automation inventory matrix documenting every automation on the object, its type, timing, and field writes",
    "Conflict analysis identifying field-write collisions and execution-order risks",
    "Refactoring plan to eliminate or guard against coexistence problems"
  ],
  "references": [
    "skills/apex/trigger-and-flow-coexistence/references/examples.md",
    "skills/apex/trigger-and-flow-coexistence/references/gotchas.md",
    "skills/apex/trigger-and-flow-coexistence/references/llm-anti-patterns.md",
    "skills/apex/trigger-and-flow-coexistence/references/well-architected.md"
  ],
  "scripts": [
    "skills/apex/trigger-and-flow-coexistence/scripts/check_trigger_and_flow_coexistence.py"
  ],
  "tags": [
    "trigger-and-flow-coexistence",
    "automation-governance",
    "field-conflict",
    "recursion",
    "order-of-execution"
  ],
  "templates": [
    "skills/apex/trigger-and-flow-coexistence/templates/trigger-and-flow-coexistence-template.md"
  ],
  "updated": "2026-04-06",
  "vector_embedding": null,
  "version": "1.0.0"
}
